ProjectID,ProjectName,Division,ClientName,ProjectManager,Superintendent,Region,Status,StartDate,TargetCompletionDate,PercentComplete,ContractValue,RiskStatus
IR-101,Northgate Medical Office Renovation,General Contracting,Northgate Health Partners,Tyler Boone,Aaron Pike,Indianapolis,Active,2025-11-03,2026-07-24,58,2480000,Watch
IR-102,Summit Logistics Tenant Buildout,General Contracting,Summit Logistics Group,Megan Foster,Julia Mays,Central Indiana,Active,2025-09-15,2026-05-30,71,3195000,Healthy
IR-103,Riverside Schools Facility Upgrade,Special Projects,Riverside Community Schools,Tyler Boone,Aaron Pike,Southwest Ohio,Active,2025-12-08,2026-08-14,34,1875000,At Risk
IR-104,Glenpark Retail Interior Refresh,Special Projects,Glenpark Retail Partners,Megan Foster,Julia Mays,Chicagoland,Closeout,2025-06-02,2026-03-18,96,940000,Watch
IR-105,Westfield Distribution Dock Expansion,General Contracting,Westfield Distribution Network,Tyler Boone,Aaron Pike,Indianapolis,Active,2025-10-20,2026-09-04,42,4280000,Watch
IR-106,Brookstone Office Suite Modernization,Field Services,Brookstone Advisory Group,Jordan Hayes,Julia Mays,Indianapolis,Closeout,2025-07-14,2026-04-10,93,615000,Healthy
IR-107,Cedar Hill Service Response Program,Field Services,Cedar Hill Property Services,Jordan Hayes,Caleb Dyer,Northern Kentucky,Active,2025-08-01,2026-12-31,64,1280000,Healthy
IR-108,IronRidge HQ Operations Refresh,Operations Support,Internal Operations,Olivia Chen,Aaron Pike,Indianapolis,Active,2026-01-06,2026-06-26,47,355000,Watch